{
  "assetName": "kitchenaid",
  "author": "tlshaw",
  "version": "1.2",
  "historical": [
    {
      "author": "tlshaw",
      "date": "2024-02-05",
      "changes": "Initial version"
    }
  ],
  "keywords": [
    "mixer",
    "kitchenaid",
    "stand mixer",
    "kitchen",
    "appliance"
  ]
}
